{"goalExecutionIRHash":"sha256:d3b658fc8267a2b29cb4f0ece2deac2dd3c5f8df984abf8135c4343cc318cf21","goalSourceBindingHash":"sha256:74464a325b8f7eee0d19645cc1dab02de93eab12975664285fce85c3f8f69f5a","profile":"standalone","resolutions":[{"evidenceClaimRefs":[],"goalObligationId":"AC-DATASERVICE-001-S01","logicalSpecSpanRefs":["SPAN-BED36CD176053228","spec-span-14c6f8b8f02ca92ded28a2b0ac7f3a4d18cea6ce20807031afe0cdec5897f243"]},{"evidenceClaimRefs":[],"goalObligationId":"AC-DATASERVICE-002-S01","logicalSpecSpanRefs":["SPAN-B8ABF4DB63ECD25D","spec-span-2435b969d8d1aa233f9df703b815443e442aa716d68dd9d7326765f62b070028"]},{"evidenceClaimRefs":[],"goalObligationId":"AC-DATASERVICE-003-S01","logicalSpecSpanRefs":["SPAN-284CCBA53D67DE83","spec-span-9df38a266efdedc4e0ea4fd49b0042f8d907769f36e62ee84e88370ded730fa4"]},{"evidenceClaimRefs":[],"goalObligationId":"AC-DATASERVICE-004-S01","logicalSpecSpanRefs":["SPAN-69FFA99C8E8966D8","spec-span-ab127e10903905641834c27e1aaa192f9476a4f93fd5f1ac266a44dde6d76e4d"]},{"evidenceClaimRefs":[],"goalObligationId":"AC-DATASERVICE-005-S01","logicalSpecSpanRefs":["SPAN-7A9B2F331A28FD61","spec-span-fbf1e829d5423a5f1029193a8b437419c86ef41a74a7d812384c59c9214339e0"]},{"evidenceClaimRefs":[],"goalObligationId":"AC-DATASERVICE-006-S01","logicalSpecSpanRefs":["SPAN-E532BC3297487BFB","spec-span-a959cae581a63bcfdb578ddcf16c7755d60f49fd15507c4cc39dc4887dd7369a"]},{"evidenceClaimRefs":[],"goalObligationId":"AC-DATASERVICE-007-S01","logicalSpecSpanRefs":["SPAN-8C80E7FE18EB9479","spec-span-6dc842c75a971f4fec43d23a87668b1903f91bf80a793f772c025da0e6581b6b"]},{"evidenceClaimRefs":[],"goalObligationId":"AC-DATASERVICE-008-S01","logicalSpecSpanRefs":["SPAN-0B6CF3FA4C99FDFF","spec-span-4a802dd7946e770df5d917278ba7fe76f3ca5306d2b27f1472f440ecc19d27a0"]},{"evidenceClaimRefs":[],"goalObligationId":"AC-DATASERVICE-009-S01","logicalSpecSpanRefs":["SPAN-817B21D3E99688AB","spec-span-93f8217c8779bea82f79f26462043e2d0bf55788f2f5c1725da67b867f209479"]},{"evidenceClaimRefs":[],"goalObligationId":"AC-DATASERVICE-009-S02","logicalSpecSpanRefs":["SPAN-8DE486DCD2DEEBE2","spec-span-f5b01e66e5d9aeb25a5eaa4e6d18fcd7f1e59e0b218435a80f19e8a2216a792a"]},{"evidenceClaimRefs":[],"goalObligationId":"AC-DATASERVICE-010-S01","logicalSpecSpanRefs":["SPAN-44C7177E0817366A","spec-span-074ef540f84329f7c417ea3e3ded18dc0f28ba0402f96ea7d04d8f960ed0029f"]},{"evidenceClaimRefs":[],"goalObligationId":"AC-DATASERVICE-011-S01","logicalSpecSpanRefs":["SPAN-86A28D6BC63AD491","spec-span-4b9d4a1a6127a5c84ac101a27f902b902fcd5e4d65fcee68979609083757cc20"]},{"evidenceClaimRefs":[],"goalObligationId":"AC-DATASERVICE-012-S01","logicalSpecSpanRefs":["SPAN-6C0C807B4BC1367C","spec-span-2db794c9d4026d695abe36e1a866f8e7625ff5bc00a72dfe0add99b655598fd8"]},{"evidenceClaimRefs":[],"goalObligationId":"AC-DATASERVICE-013-S01","logicalSpecSpanRefs":["SPAN-2540494699B33014","spec-span-39883c170fbd6110cc4dc0115a5200641c9598f02e5f69d3dab6e1e87e4ae1b9"]},{"evidenceClaimRefs":[],"goalObligationId":"AC-DATASERVICE-013-S02","logicalSpecSpanRefs":["SPAN-9BCE08382648AFE4","spec-span-a421b87745a318f72ad2250677a2397fb408c7e88ea18b79aec3ba8d6e82a08b"]},{"evidenceClaimRefs":[],"goalObligationId":"AC-DATASERVICE-014-S01","logicalSpecSpanRefs":["SPAN-A02ED94AB3023CEA","spec-span-3f60fae1cb7d7644c7cf5fea9f263976139f089a2da5171dab62c807c47a9fb1"]},{"evidenceClaimRefs":[],"goalObligationId":"AC-DATASERVICE-015-S01","logicalSpecSpanRefs":["SPAN-8CA44DAF55F36C62","spec-span-64fd5fa6478c9f265756813ebe173dbed7b3ca32e99baed828cb5ba2fdd5310c"]},{"evidenceClaimRefs":[],"goalObligationId":"AC-DATASERVICE-016-S01","logicalSpecSpanRefs":["SPAN-21AE996EC61014A3","spec-span-ff5f69156ed2d1f804f1dbbcf248272305f0388644c3f5eda98155a938acfe77"]},{"evidenceClaimRefs":[],"goalObligationId":"AC-DATASERVICE-016-S02","logicalSpecSpanRefs":["SPAN-411086ED8E83E5B0","spec-span-2133934516c22b11ad3141fab81135bbc81714cb92dab2dee0bb6ae96b2262cf"]},{"evidenceClaimRefs":[],"goalObligationId":"AC-DATASERVICE-016-S03","logicalSpecSpanRefs":["SPAN-DB318FAECD3DEFDE","spec-span-6d3666b122e3df2240546da1f056b8f4d03163174f02a0f2a19ed16ed33e8d5e"]},{"evidenceClaimRefs":[],"goalObligationId":"AC-DATASERVICE-016-S04","logicalSpecSpanRefs":["SPAN-EB2AAFC5286DEAEE","spec-span-c08b11cb3063af5295baad7f9a59b2f48860efb55ca87ef3014fda1586134288"]},{"evidenceClaimRefs":[],"goalObligationId":"AC-DATASERVICE-017-S01","logicalSpecSpanRefs":["SPAN-E2AE58C0250AAB30","spec-span-cd1208f6d34e0a39ff3542c798ee337afe7deed147f9a1f47db9778830e867df"]},{"evidenceClaimRefs":[],"goalObligationId":"AC-DATASERVICE-018-S01","logicalSpecSpanRefs":["SPAN-11315AC14DB9BA99","spec-span-3d59df9df49f59c46bd9aaef59469ce7ff7858b84a302c020f884f6a1a42229e"]},{"evidenceClaimRefs":[],"goalObligationId":"AC-DATASERVICE-019-S01","logicalSpecSpanRefs":["SPAN-873AAAAF119E3FBE","spec-span-0d98e1334b2a2c5cf780147902f10a519ea20661adc839b52d69e786639afa25"]},{"evidenceClaimRefs":[],"goalObligationId":"AC-DATASERVICE-020-S01","logicalSpecSpanRefs":["SPAN-F94B67065ABD2612","spec-span-1f92606287ccb178bc27d202ac53fe2a275bbbd1f12ae16a8247f856e608cd44"]},{"evidenceClaimRefs":[],"goalObligationId":"AC-DATASERVICE-020-S02","logicalSpecSpanRefs":["SPAN-2FD9AAAA445DB4F0","spec-span-b7f9e277cc6854e98fae7817aef6daced2495aba6be0944d2784933be9ab22da"]},{"evidenceClaimRefs":[],"goalObligationId":"AC-DATASERVICE-020-S03","logicalSpecSpanRefs":["SPAN-440365AD89DF2C15","spec-span-29e2abd76754e6c4d7cffc0280c7ad202698aa1a68c9c51eb13e24a50ea1f219"]},{"evidenceClaimRefs":[],"goalObligationId":"AC-DATASERVICE-020-S04","logicalSpecSpanRefs":["SPAN-3DAF01C9FCD69712","spec-span-b14474d378da1c3da9388301191ab439ec5a42318761ee52e8f181efe52dc675"]},{"evidenceClaimRefs":[],"goalObligationId":"AC-DATASERVICE-021-S01","logicalSpecSpanRefs":["SPAN-FF4ABD160FB8F47E","spec-span-85c0f1b0e35721ff9af8790479d5c9737f4fc0f03d2eec638071f20709c972c1"]},{"evidenceClaimRefs":[],"goalObligationId":"AC-DATASERVICE-021-S02","logicalSpecSpanRefs":["SPAN-73494F3F4329D144","spec-span-de49f7a5d3753a21f9532628b188a04bee1e15554353178e39e62a0f485d7fb4"]},{"evidenceClaimRefs":[],"goalObligationId":"AC-DATASERVICE-021-S03","logicalSpecSpanRefs":["SPAN-6D559B7BD991B304","spec-span-42e9a2294babb6766e4cb95ebdf7353142d8daddbeb78f915152b5e8abd50c88"]},{"evidenceClaimRefs":[],"goalObligationId":"AC-DATASERVICE-022-S01","logicalSpecSpanRefs":["SPAN-4767A73D33E28F5C","spec-span-009c65f48cc0548c4a3249d5f9fa0edf164dd922e44be4a301d004e684459b28"]},{"evidenceClaimRefs":[],"goalObligationId":"AC-DATASERVICE-022-S02","logicalSpecSpanRefs":["SPAN-182DC3A27608D94A","spec-span-8b4d76db048ef6b2e62427d8b7f24320d3d618440011fbb542d4d86ba7c4a0ae"]},{"evidenceClaimRefs":[],"goalObligationId":"AC-DATASERVICE-023-S01","logicalSpecSpanRefs":["SPAN-2914598AD8DCE13E","spec-span-3f07b2448039df294b237e7686c07801e1f56a585ac46a6bedb09015d8548d31"]},{"evidenceClaimRefs":[],"goalObligationId":"AC-DATASERVICE-023-S02","logicalSpecSpanRefs":["SPAN-2BE1068D725EB186","spec-span-7123b007549865a6cddcc16b69fd8fa3e66447ecb6a8f7ea61b8dd7cb4083ef3"]},{"evidenceClaimRefs":[],"goalObligationId":"AC-DATASERVICE-023-S03","logicalSpecSpanRefs":["SPAN-3E720566719A07C2","spec-span-3b9f61120e2db7da62bc6eab303d8715ab836f563a480ca8d470acabda6950da"]},{"evidenceClaimRefs":[],"goalObligationId":"AC-DATASERVICE-024-S01","logicalSpecSpanRefs":["SPAN-D11677924691BF1D","spec-span-d8e45fd7c55a2e9e0832baec70378c995390f449c050e0c218d68e97c6f01522"]},{"evidenceClaimRefs":[],"goalObligationId":"AC-DATASERVICE-024-S02","logicalSpecSpanRefs":["SPAN-75E4CCDE24EF7799","spec-span-e7cbbac1a637f9dd612d9107cae32a12e59f5b1fd8b3b7ad23c745ca21f3ce8b"]},{"evidenceClaimRefs":[],"goalObligationId":"AC-DATASERVICE-024-S03","logicalSpecSpanRefs":["SPAN-35F456807E719827","spec-span-92fdbfdf2c548e03acc47b7fdee2901cc5bd5dc4f172f3d042a51e93e64f7b93"]},{"evidenceClaimRefs":[],"goalObligationId":"NEG-DATASERVICE-001","logicalSpecSpanRefs":["SPAN-C54D69D3508C7DAE","spec-span-92d5a338edab9e1aaba052c9bc3e5941e0afc99bb541cc8d5b1e7754312a2ccc"]},{"evidenceClaimRefs":[],"goalObligationId":"NEG-DATASERVICE-002","logicalSpecSpanRefs":["SPAN-DF0B586ACEB91878","spec-span-0affd76604bb8f998f3cd70188ce98f62a03a3add6063780ef872b3c4364e45a"]},{"evidenceClaimRefs":[],"goalObligationId":"NEG-DATASERVICE-003","logicalSpecSpanRefs":["SPAN-5F87952C09046E19","spec-span-a9a0bf88f1a356e8969df58810ca2b9c25901aa93457e4ad1772139631610940"]},{"evidenceClaimRefs":[],"goalObligationId":"NEG-DATASERVICE-004","logicalSpecSpanRefs":["SPAN-855C0F5275CD3625","spec-span-ef1bf53b71c5d85fb9f22b1266c53b33fce35a1f32e3c3efa50fe224f5adba49"]},{"evidenceClaimRefs":[],"goalObligationId":"NEG-DATASERVICE-005","logicalSpecSpanRefs":["SPAN-ADE75741CDAAA2D3","spec-span-bc2cd7fec40b83c9901907e1b1cf06e1a4aa2a2ced3acd28fafaa9bd96d85977"]},{"evidenceClaimRefs":[],"goalObligationId":"NEG-DATASERVICE-006","logicalSpecSpanRefs":["SPAN-805206173A3D54BD","spec-span-2eff952cd5884f51147836726c0a587d1ebcdec0634be48312e73a1d716020a9"]},{"evidenceClaimRefs":[],"goalObligationId":"NEG-DATASERVICE-007","logicalSpecSpanRefs":["SPAN-5E84EF091A75BEF8","spec-span-0c80e42e9da1565e48ef74a59aa3ea471aafcf22be1a0ac2c748b5b984957d1d"]},{"evidenceClaimRefs":[],"goalObligationId":"NEG-DATASERVICE-008","logicalSpecSpanRefs":["SPAN-D063B5835EF38585","spec-span-b5b4d9f685175765c196f4a8a9ce27c209131f0f09e6eec3704d40bef6d5fb03"]},{"evidenceClaimRefs":[],"goalObligationId":"NEG-DATASERVICE-009","logicalSpecSpanRefs":["SPAN-AAA0CECDD5CF2926","spec-span-448856f9ef1d20f1589073999a7981afaf15ef5d9546c37c4b079f8e2f10c668"]},{"evidenceClaimRefs":[],"goalObligationId":"NEG-DATASERVICE-010","logicalSpecSpanRefs":["SPAN-27FC02B44472F7B1","spec-span-ea647ae46f68e29e1535d0ffaaf5bdd2e99dbc79051791b935131e480dd377c1"]},{"evidenceClaimRefs":[],"goalObligationId":"NEG-DATASERVICE-011","logicalSpecSpanRefs":["SPAN-323EF18CFD805F8C","spec-span-5560ef6fd0eb8cf2b9fe8fe4328c0fca0bdc4eacea7d312e155046a8dcaee169"]},{"evidenceClaimRefs":[],"goalObligationId":"NEG-DATASERVICE-012","logicalSpecSpanRefs":["SPAN-BAED23